{
  "name": "duplicate-ids",
  "infrastructure": [
    {
      "id": "aws_infra",
      "kind": "vm",
      "provider": "aws",
      "region": "us-west-2"
    },
    {
      "id": "aws_infra",
      "kind": "vm",
      "provider": "aws",
      "region": "us-east-1"
    }
  ],
  "nodes": [
    {
      "id": "node1",
      "infrastructure_id": "aws_infra",
      "properties": {
        "instance_type": "t2.micro"
      },
      "remote_access": {
        "public_ssh_key": "/path/to/key.pub"
      }
    }
  ],
  "devcontainers": [
    {
      "id": "dev1",
      "node_id": "node1",
      "source": {
        "url": "https://github.com/example/repo.git"
      }
    }
  ]
}