{
	"name": "unreferenced-node",
	"infrastructure": [
		{
			"id": "infrastructure1",
			"kind": "vm",
			"provider": "aws",
			"region": "us-west-2"
		}
	],
	"nodes": [
		{
			"id": "node1",
			"infrastructure_id": "infrastructure1",
			"properties": {
				"instance_type": "t2.micro"
			},
			"remote_access": {
				"public_ssh_key": "~/.ssh/id_rsa.pub"
			}
		},
		{
			"id": "node2",
			"infrastructure_id": "infrastructure1",
			"properties": {
				"instance_type": "t2.medium"
			},
			"remote_access": {
				"public_ssh_key": "/etc/ssh/ssh_host_rsa_key.pub"
			}
		}
	],
	"devcontainers": [
		{
			"id": "devcontainer1",
			"node_id": "node1",
			"source": {
				"url": "https://github.com/example/repo.git"
			}
		}
	]
} 