{
	"name": "duplicate-infra-id",
	"infrastructure": [
		{
			"id": "infrastructure1",
			"kind": "vm",
			"provider": "aws",
			"region": "us-west-2"
		},
		{
			"id": "infrastructure1",
			"kind": "vm",
			"provider": "aws",
			"region": "us-east-1"
		}
	],
	"nodes": [
		{
			"id": "node1",
			"infrastructure_id": "infrastructure1",
			"properties": {
				"instance_type": "t2.micro"
			},
			"remote_access": {
				"public_ssh_key": "~/.ssh/id_rsa.pub"
			}
		}
	],
	"devcontainers": [
		{
			"id": "devcontainer1",
			"node_id": "node1",
			"source": {
				"url": "https://github.com/example/repo.git"
			}
		}
	]
} 